{
  "schema": "lamina.semantic-fixture/v1",
  "id": "compact-product-lifecycle",
  "description": "Reviewed compact product lifecycle covering canonical truth, provenance, publication atomicity, branch isolation, concurrency, obligations, and rebuildable derived state.",
  "expected": {
    "branches": [
      {
        "active_relation_ids": [
          "stmt_0cac7b856a391d7cfeb7d079f9b3883d",
          "stmt_13ecbe599327dbab0ad26eb90301502d",
          "stmt_2eaac03e9124f9e9a97d940c618ea532",
          "stmt_32703a775c151193c7de7acc2ea6d59c",
          "stmt_641a66f358183fdbb94a4d45b3726c83",
          "stmt_75d3699e8190a6f2831c445bdd64550f",
          "stmt_7adadddbb4cd8167905faef89b4e2486",
          "stmt_80bd5df09cf3b472148c629182773ced",
          "stmt_81627a363caeda90c077925ef3dfd884",
          "stmt_87725d4b309d7410e7db24ad63d083cd",
          "stmt_959f4ab7ee88ef57d301f72aff3402e8",
          "stmt_9776197105522e3f8752e1cb83833bdc",
          "stmt_cf817c52e1e5570c0b3166097aaff671",
          "stmt_d089e25e4457d9bc933d185f8870ad97",
          "stmt_d144173bc0b14c9f7a09b27fe022ac63",
          "stmt_d42149a64ba4c80c24a2be8cfc36e3e9",
          "stmt_fce80c2305a404df8bb2bd729b6a6a91"
        ],
        "active_resource_ids": [
          "actor.reviewer",
          "contradiction_2539d3cd0984773f1eae03c3f6cb73e0",
          "decision.manual-review",
          "entity.concurrent-a",
          "entity.concurrent-b",
          "evidence.human-review",
          "harness.approval",
          "invariant.separation",
          "observation.route",
          "operation.approve",
          "operation.archive",
          "persona.operator",
          "product.checkout",
          "proof.audit",
          "scenario.denied",
          "state.approved",
          "state.pending",
          "surface.feature-only",
          "surface.review",
          "workflow.approval"
        ],
        "head_version_id": "version_02e53df367a088c5f0d1a4efbe4f41fa",
        "id": "branch:feature/semantic-isolation",
        "name": "feature/semantic-isolation",
        "source_revision": "d7a2ff9df80af73aab18621823d28a0ea583a81a"
      },
      {
        "active_relation_ids": [
          "stmt_0cac7b856a391d7cfeb7d079f9b3883d",
          "stmt_13ecbe599327dbab0ad26eb90301502d",
          "stmt_2eaac03e9124f9e9a97d940c618ea532",
          "stmt_32703a775c151193c7de7acc2ea6d59c",
          "stmt_641a66f358183fdbb94a4d45b3726c83",
          "stmt_75d3699e8190a6f2831c445bdd64550f",
          "stmt_7adadddbb4cd8167905faef89b4e2486",
          "stmt_80bd5df09cf3b472148c629182773ced",
          "stmt_81627a363caeda90c077925ef3dfd884",
          "stmt_87725d4b309d7410e7db24ad63d083cd",
          "stmt_959f4ab7ee88ef57d301f72aff3402e8",
          "stmt_9776197105522e3f8752e1cb83833bdc",
          "stmt_cf817c52e1e5570c0b3166097aaff671",
          "stmt_d089e25e4457d9bc933d185f8870ad97",
          "stmt_d144173bc0b14c9f7a09b27fe022ac63",
          "stmt_d42149a64ba4c80c24a2be8cfc36e3e9",
          "stmt_fce80c2305a404df8bb2bd729b6a6a91"
        ],
        "active_resource_ids": [
          "actor.reviewer",
          "contradiction_2539d3cd0984773f1eae03c3f6cb73e0",
          "decision.manual-review",
          "entity.concurrent-a",
          "entity.concurrent-b",
          "evidence.human-review",
          "harness.approval",
          "invariant.separation",
          "observation.route",
          "operation.approve",
          "operation.archive",
          "persona.operator",
          "product.checkout",
          "proof.audit",
          "scenario.denied",
          "state.approved",
          "state.pending",
          "surface.review",
          "workflow.approval"
        ],
        "head_version_id": "version_c87c0fd50eeb0be5363e39a4e9901519",
        "id": "branch:main",
        "name": "main",
        "source_revision": "d7a2ff9df80af73aab18621823d28a0ea583a81a"
      }
    ],
    "contradictions": [
      {
        "id": "contradiction_2539d3cd0984773f1eae03c3f6cb73e0",
        "member_ids": [
          "stmt_2eaac03e9124f9e9a97d940c618ea532",
          "stmt_81627a363caeda90c077925ef3dfd884"
        ],
        "type": "statement_conflict"
      }
    ],
    "derived_state": [
      {
        "authoritative": false,
        "canonical_head_after": "version_c87c0fd50eeb0be5363e39a4e9901519",
        "canonical_head_before": "version_c87c0fd50eeb0be5363e39a4e9901519",
        "id": "derived:main-retrieval-index",
        "kind": "retrieval_index",
        "rebuild_digest_after": "semantic_751d3b98b0cada89f2dcc4b62f309a13ce23ef11fa72ab7d9da16161383a1b70",
        "rebuild_digest_before": "semantic_751d3b98b0cada89f2dcc4b62f309a13ce23ef11fa72ab7d9da16161383a1b70",
        "rebuildable": true,
        "source_revision": "d7a2ff9df80af73aab18621823d28a0ea583a81a",
        "source_version_id": "version_c87c0fd50eeb0be5363e39a4e9901519"
      }
    ],
    "graph_versions": [
      {
        "active_relation_ids": [
          "stmt_0cac7b856a391d7cfeb7d079f9b3883d",
          "stmt_13ecbe599327dbab0ad26eb90301502d",
          "stmt_2eaac03e9124f9e9a97d940c618ea532",
          "stmt_32703a775c151193c7de7acc2ea6d59c",
          "stmt_641a66f358183fdbb94a4d45b3726c83",
          "stmt_75d3699e8190a6f2831c445bdd64550f",
          "stmt_7adadddbb4cd8167905faef89b4e2486",
          "stmt_80bd5df09cf3b472148c629182773ced",
          "stmt_81627a363caeda90c077925ef3dfd884",
          "stmt_87725d4b309d7410e7db24ad63d083cd",
          "stmt_959f4ab7ee88ef57d301f72aff3402e8",
          "stmt_9776197105522e3f8752e1cb83833bdc",
          "stmt_cf817c52e1e5570c0b3166097aaff671",
          "stmt_d089e25e4457d9bc933d185f8870ad97",
          "stmt_d144173bc0b14c9f7a09b27fe022ac63",
          "stmt_d42149a64ba4c80c24a2be8cfc36e3e9",
          "stmt_fce80c2305a404df8bb2bd729b6a6a91"
        ],
        "active_resource_ids": [
          "actor.reviewer",
          "contradiction_2539d3cd0984773f1eae03c3f6cb73e0",
          "decision.manual-review",
          "entity.concurrent-a",
          "entity.concurrent-b",
          "evidence.human-review",
          "harness.approval",
          "invariant.separation",
          "observation.route",
          "operation.approve",
          "operation.archive",
          "persona.operator",
          "product.checkout",
          "proof.audit",
          "scenario.denied",
          "state.approved",
          "state.pending",
          "surface.feature-only",
          "surface.review",
          "workflow.approval"
        ],
        "added_relation_ids": [],
        "added_resource_ids": [
          "surface.feature-only"
        ],
        "id": "version_02e53df367a088c5f0d1a4efbe4f41fa",
        "parent_ids": [
          "version_c87c0fd50eeb0be5363e39a4e9901519"
        ],
        "retired_relation_ids": [],
        "retired_resource_ids": [],
        "source_revision": "d7a2ff9df80af73aab18621823d28a0ea583a81a",
        "validation": {
          "approved": false,
          "contradiction_ids": [
            "contradiction_2539d3cd0984773f1eae03c3f6cb73e0"
          ],
          "implementation_ready": false,
          "mechanically_valid": true,
          "readiness_gap_codes": [
            "persona_walk_missing"
          ],
          "verified": false
        }
      },
      {
        "active_relation_ids": [
          "stmt_0cac7b856a391d7cfeb7d079f9b3883d",
          "stmt_13ecbe599327dbab0ad26eb90301502d",
          "stmt_2eaac03e9124f9e9a97d940c618ea532",
          "stmt_32703a775c151193c7de7acc2ea6d59c",
          "stmt_641a66f358183fdbb94a4d45b3726c83",
          "stmt_75d3699e8190a6f2831c445bdd64550f",
          "stmt_7adadddbb4cd8167905faef89b4e2486",
          "stmt_80bd5df09cf3b472148c629182773ced",
          "stmt_87725d4b309d7410e7db24ad63d083cd",
          "stmt_959f4ab7ee88ef57d301f72aff3402e8",
          "stmt_9776197105522e3f8752e1cb83833bdc",
          "stmt_cf817c52e1e5570c0b3166097aaff671",
          "stmt_d089e25e4457d9bc933d185f8870ad97",
          "stmt_d144173bc0b14c9f7a09b27fe022ac63",
          "stmt_d42149a64ba4c80c24a2be8cfc36e3e9",
          "stmt_fce80c2305a404df8bb2bd729b6a6a91"
        ],
        "active_resource_ids": [
          "actor.reviewer",
          "decision.manual-review",
          "evidence.human-review",
          "harness.approval",
          "invariant.separation",
          "observation.route",
          "operation.approve",
          "operation.archive",
          "persona.operator",
          "product.checkout",
          "proof.audit",
          "scenario.denied",
          "state.approved",
          "state.pending",
          "surface.review",
          "workflow.approval"
        ],
        "added_relation_ids": [
          "stmt_0cac7b856a391d7cfeb7d079f9b3883d",
          "stmt_13ecbe599327dbab0ad26eb90301502d",
          "stmt_2eaac03e9124f9e9a97d940c618ea532",
          "stmt_32703a775c151193c7de7acc2ea6d59c",
          "stmt_641a66f358183fdbb94a4d45b3726c83",
          "stmt_75d3699e8190a6f2831c445bdd64550f",
          "stmt_7adadddbb4cd8167905faef89b4e2486",
          "stmt_80bd5df09cf3b472148c629182773ced",
          "stmt_87725d4b309d7410e7db24ad63d083cd",
          "stmt_959f4ab7ee88ef57d301f72aff3402e8",
          "stmt_9776197105522e3f8752e1cb83833bdc",
          "stmt_cf817c52e1e5570c0b3166097aaff671",
          "stmt_d089e25e4457d9bc933d185f8870ad97",
          "stmt_d144173bc0b14c9f7a09b27fe022ac63",
          "stmt_d42149a64ba4c80c24a2be8cfc36e3e9",
          "stmt_fce80c2305a404df8bb2bd729b6a6a91"
        ],
        "added_resource_ids": [
          "actor.reviewer",
          "decision.manual-review",
          "evidence.human-review",
          "harness.approval",
          "invariant.separation",
          "observation.route",
          "operation.approve",
          "operation.archive",
          "persona.operator",
          "product.checkout",
          "proof.audit",
          "scenario.denied",